{
  "result_schema_id": "urn:gdo:phase1-closure-result:1.0.0",
  "result_contract_id": "GDO_PHASE1_CLOSURE_RESULT",
  "result_contract_version": "1.0.0",
  "result_id": "gdo-phase1-closure:b59c1eb5d03c343e83b8df67c13c4b4525077f78476cee87ca28cbe024a3375e",
  "phase_id": "GDO_PHASE1",
  "phase_status": "CLOSED",
  "gdo_head": "b207fc9e1c56ca019d99384173e672f065c7557e",
  "gds_docs_head": "7a3714578e73d136de8ef89d436939042c2f2745",
  "registry_id": "GHOST-DEVELOPMENT-ORCHESTRATOR-PROVISIONAL",
  "registry_status": "Active",
  "registry_record_digest": "sha256:1322cc66a59306cbbc6f483a62aac2f718fee64d3abf446bd14f1b25524d5027",
  "schema_version": 7,
  "completed_sequence_count": 14,
  "capability_scope": "PHASE1_BOUNDED_LOCAL_ORCHESTRATION",
  "post_activation_result": {"result_id": "gdo-post-activation:1b969efed1fbf315a4c8ba6bd2fee8ac9b1fe99f01418d67c6adc4486e2e731f", "result_digest": "sha256:032981e480a69574469817fcf85ac76d543b9faf7e9e11515078c05684a09191", "overall_result": "PASS_WITH_WARNING"},
  "remaining_warnings": [{"warning_class": "LOCAL_ENVIRONMENT_DEPENDENCY", "owner": "Project Owner", "scope": "in-process Runtime provider dependency environment", "impact": "Provider Startup requires the pinned dependency environment.", "workaround": "Use the approved runtime-policy extra or Runtime .policy-deps.", "follow_up_trigger": "Before first operational Phase 1 use.", "activation_safe": true, "fail_behavior": "FAIL_CLOSED"}],
  "tag_recommendation": "TAG_RECOMMENDED_SEPARATE_APPROVAL_REQUIRED",
  "release_recommendation": "RELEASE_NOT_RECOMMENDED_FOR_PHASE1_CLOSURE",
  "phase2_entry_status": "ENTRY_CONDITIONS_DEFINED_NOT_AUTHORIZED",
  "closure_result": "PASS_WITH_WARNING",
  "execution_authority": false,
  "registry_mutation_executed": false,
  "tag_executed": false,
  "release_executed": false
}
